{
 "run_id": "adr_3322182605da76d37631b9dc0e0e7cbf",
 "step_id": "C_hypotheses",
 "step_type": "AGENT_REASON",
 "sequence": 5,
 "issued_at": "2026-09-13T18:30:41Z",
 "objective": "From the retrieved Polymath evidence only, generate up to 8 latent hypotheses: a population doing a repeated activity meets a recurring friction with a plausible mechanism. State assumptions, falsifiers and the knowledge gaps that only the live world can close. Cite evidence ids for every hypothesis; list unknowns instead of inventing.",
 "context": {
  "evidence_refs": [
   {
    "kind": "chunk",
    "id": "chunk_7f3a",
    "corpus_id": "cinema",
    "doc_id": "doc_554b59",
    "score": 0.81
   },
   {
    "kind": "graph_fact",
    "id": "fact_19c2",
    "corpus_id": "cinema"
   },
   {
    "kind": "query_receipt",
    "id": "qr_4d0e"
   }
  ],
  "inputs": {
   "seed": "outdoor cold-plunge recovery routines for amateur athletes"
  },
  "prior_step_ids": [
   "A_understand",
   "B_plan",
   "B_retrieve",
   "B_graph"
  ],
  "hypotheses": [],
  "registry_snapshot": null
 },
 "constraints": [
  "Cite only evidence_refs supplied in context; registry priors (trail_prior) are coordinates, never evidence",
  "No opportunity score, rank or weight of any kind (LAW 1)",
  "Preserve contradictions with their evidence ids"
 ],
 "output_schema": {
  "type": "object",
  "required": [
   "hypotheses"
  ],
  "additionalProperties": false,
  "properties": {
   "hypotheses": {
    "type": "array",
    "minItems": 1,
    "maxItems": 8,
    "items": {
     "type": "object",
     "required": [
      "statement",
      "supporting_evidence_ids"
     ],
     "additionalProperties": false,
     "properties": {
      "statement": {
       "type": "string",
       "minLength": 8,
       "maxLength": 2000
      },
      "mechanism": {
       "type": [
        "string",
        "null"
       ]
      },
      "population": {
       "type": [
        "string",
        "null"
       ]
      },
      "activity": {
       "type": [
        "string",
        "null"
       ]
      },
      "task": {
       "type": [
        "string",
        "null"
       ]
      },
      "context": {
       "type": [
        "string",
        "null"
       ]
      },
      "suspected_friction": {
       "type": [
        "string",
        "null"
       ]
      },
      "supporting_evidence_ids": {
       "type": "array",
       "items": {
        "type": "string"
       },
       "minItems": 1
      },
      "support_roles": {
       "type": "object"
      },
      "contradictions": {
       "type": "array",
       "items": {
        "type": "object",
        "required": [
         "statement",
         "evidence_ids"
        ],
        "properties": {
         "statement": {
          "type": "string"
         },
         "evidence_ids": {
          "type": "array",
          "items": {
           "type": "string"
          }
         }
        }
       }
      },
      "assumptions": {
       "type": "array",
       "items": {
        "type": "string"
       }
      },
      "falsifiers": {
       "type": "array",
       "items": {
        "type": "string"
       }
      },
      "knowledge_gaps": {
       "type": "array",
       "items": {
        "type": "object",
        "required": [
         "question",
         "evidence_role"
        ],
        "properties": {
         "question": {
          "type": "string"
         },
         "evidence_role": {
          "type": "string"
         }
        }
       }
      },
      "trail_priors": {
       "type": "array",
       "items": {
        "type": "object",
        "required": [
         "registry_record_id",
         "prior_role"
        ],
        "properties": {
         "registry_record_id": {
          "type": "string"
         },
         "prior_role": {
          "type": "string"
         }
        }
       }
      }
     }
    }
   }
  }
 },
 "acceptance_rules": [
  "every supporting_evidence_ids entry is a knowledge id from context.evidence_refs",
  "1 <= len(hypotheses) <= 8"
 ],
 "external": null,
 "expires_at": null,
 "cognitive_op": "theta",
 "theta_op": "generate_hypotheses",
 "harness_action": null
}
